{
  "$schema": "https://json-schema.org/draft/2020-12/schema",
  "$id": "https://kgdistiller.dev/schemas/qlkg-search-result-v3.schema.json",
  "title": "kgdistiller bounded deterministic search result v3",
  "type": "object",
  "additionalProperties": false,
  "required": ["schema", "plan_sha256", "lanes", "results"],
  "properties": {
    "schema": {"const": "qlkg-search-result-v3"},
    "plan_sha256": {"$ref": "#/$defs/sha256"},
    "lanes": {
      "type": "object",
      "additionalProperties": false,
      "required": ["identity", "lexical", "graph", "ppr"],
      "properties": {
        "identity": {"$ref": "#/$defs/queryLane"},
        "lexical": {"$ref": "#/$defs/queryLane"},
        "graph": {"$ref": "#/$defs/seedLane"},
        "ppr": {"$ref": "#/$defs/seedLane"}
      }
    },
    "results": {"type": "array", "maxItems": 500, "items": {"$ref": "#/$defs/result"}}
  },
  "$defs": {
    "sha256": {"type": "string", "pattern": "^[0-9a-f]{64}$"},
    "nodeId": {"type": "string", "minLength": 1, "maxLength": 256, "pattern": "^[a-z0-9]+(?:-[a-z0-9]+)*$"},
    "edgeType": {"enum": ["contains", "prerequisite-for", "implies", "generalizes", "contrasts-with", "derived-from"]},
    "status": {"enum": ["enabled", "disabled", "degraded", "error"]},
    "reason": {"type": "string", "minLength": 1, "maxLength": 256, "pattern": "^[a-z0-9][a-z0-9._-]*$"},
    "queryLane": {
      "type": "object",
      "additionalProperties": false,
      "required": ["status", "queries", "results"],
      "properties": {
        "status": {"$ref": "#/$defs/status"},
        "queries": {"type": "integer", "minimum": 0, "maximum": 32},
        "results": {"type": "integer", "minimum": 0, "maximum": 500},
        "reason": {"$ref": "#/$defs/reason"}
      },
      "allOf": [{"if": {"properties": {"status": {"const": "enabled"}}}, "else": {"required": ["reason"]}}]
    },
    "seedLane": {
      "type": "object",
      "additionalProperties": false,
      "required": ["status", "seeds", "results"],
      "properties": {
        "status": {"$ref": "#/$defs/status"},
        "seeds": {"type": "integer", "minimum": 0, "maximum": 128},
        "results": {"type": "integer", "minimum": 0, "maximum": 500},
        "reason": {"$ref": "#/$defs/reason"}
      },
      "allOf": [{"if": {"properties": {"status": {"const": "enabled"}}}, "else": {"required": ["reason"]}}]
    },
    "laneEvidence": {
      "type": "object",
      "additionalProperties": false,
      "required": ["rank", "score"],
      "properties": {
        "rank": {"type": "integer", "minimum": 1, "maximum": 500},
        "score": {"type": "number"}
      }
    },
    "resultLanes": {
      "type": "object",
      "additionalProperties": false,
      "minProperties": 1,
      "maxProperties": 4,
      "properties": {
        "identity": {"$ref": "#/$defs/laneEvidence"},
        "lexical": {"$ref": "#/$defs/laneEvidence"},
        "graph": {"$ref": "#/$defs/laneEvidence"},
        "ppr": {"$ref": "#/$defs/laneEvidence"}
      }
    },
    "seedEvidence": {
      "type": "object",
      "additionalProperties": false,
      "required": ["lane", "seed_id"],
      "properties": {
        "lane": {"enum": ["graph", "ppr"]},
        "seed_id": {"$ref": "#/$defs/nodeId"}
      }
    },
    "pathEvidence": {
      "type": "object",
      "additionalProperties": false,
      "required": ["lane", "nodes", "edge_types"],
      "properties": {
        "lane": {"enum": ["graph", "ppr"]},
        "nodes": {"type": "array", "minItems": 1, "maxItems": 10, "items": {"$ref": "#/$defs/nodeId"}},
        "edge_types": {"type": "array", "maxItems": 9, "items": {"$ref": "#/$defs/edgeType"}}
      }
    },
    "fusion": {
      "type": "object",
      "additionalProperties": false,
      "required": ["method", "score", "explanation"],
      "properties": {
        "method": {"enum": ["rrf", "weighted", "single-lane"]},
        "score": {"type": "number"},
        "explanation": {"type": "array", "minItems": 1, "maxItems": 16, "items": {"type": "string", "minLength": 1, "maxLength": 1024}}
      }
    },
    "result": {
      "type": "object",
      "additionalProperties": false,
      "required": ["node_id", "node_type", "label", "lanes", "seed_evidence", "path_evidence", "fusion"],
      "properties": {
        "node_id": {"$ref": "#/$defs/nodeId"},
        "node_type": {"enum": ["knowledge", "field", "topic"]},
        "label": {"type": "string", "minLength": 1, "maxLength": 1024},
        "lanes": {"$ref": "#/$defs/resultLanes"},
        "seed_evidence": {"type": "array", "maxItems": 32, "items": {"$ref": "#/$defs/seedEvidence"}},
        "path_evidence": {"type": "array", "maxItems": 32, "items": {"$ref": "#/$defs/pathEvidence"}},
        "fusion": {"$ref": "#/$defs/fusion"}
      }
    }
  }
}
