{
  "schema": "qlkg-search-result-v3",
  "plan_sha256": "1111111111111111111111111111111111111111111111111111111111111111",
  "lanes": {
    "identity": {"status": "enabled", "queries": 1, "results": 1},
    "lexical": {"status": "enabled", "queries": 1, "results": 1},
    "graph": {"status": "enabled", "seeds": 1, "results": 1},
    "ppr": {"status": "degraded", "seeds": 1, "results": 0, "reason": "insufficient-seeds"}
  },
  "results": [
    {
      "node_id": "synthetic-theorem",
      "node_type": "knowledge",
      "label": "Synthetic theorem",
      "lanes": {
        "identity": {"rank": 1, "score": 1.0},
        "lexical": {"rank": 1, "score": 0.75},
        "graph": {"rank": 1, "score": 1.0}
      },
      "seed_evidence": [{"lane": "graph", "seed_id": "synthetic-premise"}],
      "path_evidence": [{"lane": "graph", "nodes": ["synthetic-premise", "synthetic-theorem"], "edge_types": ["prerequisite-for"]}],
      "fusion": {"method": "rrf", "score": 0.048, "explanation": ["Matched identity, lexical, and graph lanes."]}
    }
  ]
}
